{
  "schemaVersion": "synthi.codesite.filesystemBoundaryProof.v1",
  "proofId": "fs-boundary-cmr5libx0005cpm0zze7kc03q",
  "projectId": "cmr5lhrju000dpm0z9sb64ur7",
  "workspaceSlug": "codesite-mature-full-proof-20260703-overlay8",
  "eventId": "cmr5libx0005cpm0zze7kc03q",
  "policyDecisionId": "cmr5libwv005apm0zfo9u9v6m",
  "eventType": "write_denied",
  "disposition": "write_denied",
  "prevented": true,
  "quarantined": false,
  "path": "secrets/prod.env",
  "transactionId": "cmr5li1840030pm0ziuph9b1r",
  "mutationLeaseId": null,
  "requestedMutationLeaseId": "cmr5lhw270020pm0zv2swrhf0",
  "inspectedLeases": [],
  "displayCallsign": "SCHEMA-01",
  "leaseState": "unmatched_clearance",
  "lease": null,
  "reasonCodes": [
    "outside_clearance_route"
  ],
  "reason": "raw-terminal-write denied for secrets/prod.env: outside_clearance_route",
  "zone": {
    "zoneKey": "unclassified",
    "label": "Unclassified repo airspace",
    "class": "C",
    "risk": "medium",
    "rules": [
      "auto_clearance_allowed",
      "landing_inspection_required"
    ],
    "path": "secrets/prod.env"
  },
  "boundary": {
    "source": "codesitefs",
    "tool": "file_write",
    "operation": "raw-terminal-write",
    "actorType": "codesitefs",
    "actorId": "cmr5libwv005apm0zfo9u9v6m"
  },
  "process": {
    "ancestry": [
      "mcp:synthi_codesite_apply_patch",
      "codex:tmp-proof-session"
    ],
    "display": "mcp:synthi_codesite_apply_patch <- codex:tmp-proof-session"
  },
  "evidence": {
    "refs": [
      "event:cmr5libx0005cpm0zze7kc03q",
      "mcp:audit:codesitefs-denied-full-workflow"
    ],
    "lineProvenanceCount": 0,
    "changedLineRanges": [],
    "dojoSourceRefs": []
  },
  "evidenceRefs": [
    "event:cmr5libx0005cpm0zze7kc03q",
    "mcp:audit:codesitefs-denied-full-workflow"
  ],
  "quarantine": null,
  "proofComplete": true,
  "missingProofFields": [],
  "createdAt": "2026-07-03T23:59:51.252Z"
}
