{
  "schemaVersion": "synthi.codesite.filesystemBoundaryProof.v1",
  "proofId": "fs-boundary-cmr76u5pu00e5qk019j5wpqyo",
  "projectId": "cmr76rvc3008sqk01itxc3o8s",
  "workspaceSlug": "codesite-full-workflow-proof-1783219369293",
  "eventId": "cmr76u5pu00e5qk019j5wpqyo",
  "policyDecisionId": "cmr76u5pf00e3qk01wmn1puqo",
  "eventType": "write_quarantined",
  "disposition": "write_quarantined",
  "prevented": true,
  "quarantined": true,
  "path": "synthi/prisma/schema.prisma",
  "transactionId": "cmr76sqte00blqk01jga6jnj3",
  "mutationLeaseId": "cmr76s97i00alqk01mvljd1m6",
  "requestedMutationLeaseId": null,
  "inspectedLeases": [],
  "displayCallsign": "SCHEMA-01",
  "leaseState": "matched_clearance",
  "lease": {
    "id": "cmr76s97i00alqk01mvljd1m6",
    "displayCallsign": "SCHEMA-01",
    "status": "active",
    "allowedPaths": [
      "synthi/prisma/**"
    ],
    "blockedPaths": [
      "secrets/**"
    ],
    "allowedTools": [
      "file_write"
    ],
    "dojoLicenseRef": "schema.level_2@2026-06-25",
    "dojoProofRef": "pcap-full-workflow-schema"
  },
  "reasonCodes": [
    "raw_terminal_quarantine"
  ],
  "reason": "Raw terminal modified quarantined for synthi/prisma/schema.prisma",
  "zone": {
    "zoneKey": "class_b",
    "label": "Shared contract airspace",
    "class": "B",
    "paths": [
      "packages/schemas/**",
      "openapi/**",
      "packages/*/src/index.ts",
      "synthi/prisma/**",
      "backend/collab-server/permissionMiddleware.js"
    ],
    "rules": [
      "flight_plan_required",
      "downstream_notification_required",
      "change_order_for_mutation"
    ],
    "risk": "high",
    "source": "compiled_default",
    "path": "synthi/prisma/schema.prisma"
  },
  "boundary": {
    "source": "codesitefs",
    "tool": "raw_terminal",
    "operation": "raw_terminal",
    "actorType": "codesitefs",
    "actorId": "cmr76u5pf00e3qk01wmn1puqo"
  },
  "process": {
    "ancestry": [
      "mcp:synthi_codesite_apply_patch",
      "codex:tmp-proof-session",
      "node",
      "sh",
      "npm-run-codesite-proof-full-workflow",
      "codex",
      "init"
    ],
    "display": "mcp:synthi_codesite_apply_patch <- codex:tmp-proof-session <- node <- sh <- npm-run-codesite-proof-full-workflow <- codex <- init"
  },
  "evidence": {
    "refs": [
      "event:cmr76u5pu00e5qk019j5wpqyo",
      "codesitefs:quarantine:sha256:e9f2c6f943782d6545d875372973434641d5a5a90723531c2cc96a745fd39432"
    ],
    "lineProvenanceCount": 0,
    "changedLineRanges": [],
    "dojoSourceRefs": []
  },
  "evidenceRefs": [
    "event:cmr76u5pu00e5qk019j5wpqyo",
    "codesitefs:quarantine:sha256:e9f2c6f943782d6545d875372973434641d5a5a90723531c2cc96a745fd39432"
  ],
  "quarantine": {
    "quarantineId": "qtn-cmr76sqte00blqk01jga6jnj3-1783219478987-45f2c017",
    "evidenceRef": "codesitefs:quarantine:sha256:e9f2c6f943782d6545d875372973434641d5a5a90723531c2cc96a745fd39432",
    "kind": "modified",
    "beforeDigest": "sha256:e63f6070ae54fae3ca685e7a714ab9b6ab8a0e79563fe91c316eddce282b8a1f",
    "afterDigest": "sha256:f35544b0386043c862271efbcccec8b2ea18734b77ce100e5635fc7219f1ce30",
    "symlinkSanitization": null
  },
  "proofComplete": true,
  "missingProofFields": [],
  "createdAt": "2026-07-05T02:44:41.202Z"
}
